{
  "schemaVersion": "4.4.0",
  "waVersion": "2.3000.1052559453",
  "binaries": [
    {
      "name": "/wasm/whatsapp/versioned/c73edd705435d0d22b19fd3817c9bed536d8bc6a5fbe8a927cbd277fa26fff4f/wa_voip_shared.wasm",
      "modules": [
        "WAWebVoipWebWasmLoader_ContentAddressed_internal"
      ]
    },
    {
      "name": "dgwcppbridge.wasm",
      "modules": [
        "DGWCppBridge"
      ]
    },
    {
      "name": "liboqs_wasm_wrapper.wasm",
      "modules": [
        "WALiboqsWasm"
      ]
    },
    {
      "name": "smax-mocks/smax_mocks_wasm.wasm",
      "modules": [
        "WAWebDebugFlipper"
      ]
    },
    {
      "name": "smax_mocks_wasm.wasm",
      "modules": [
        "WASmaxMocksWasm"
      ]
    },
    {
      "name": "theia_ratls_wasm.wasm",
      "modules": [
        "WATheiaRaTlsWasm"
      ]
    }
  ],
  "resources": [
    {
      "bxId": "10047",
      "consumers": [
        "WAWebPtvMessageComponent"
      ],
      "wasmHint": []
    },
    {
      "bxId": "10639",
      "consumers": [
        "WAWebCommunityGeneralChatImage.react"
      ],
      "wasmHint": []
    },
    {
      "bxId": "110517",
      "consumers": [
        "WAWebBizAIAppointmentsDrawer.react"
      ],
      "wasmHint": []
    },
    {
      "bxId": "110635",
      "consumers": [
        "WAWebVoipWebWasmBxRefs",
        "WAWebVoipWebWasmLoader_ContentAddressed_internal"
      ],
      "wasmHint": [
        "moduleName",
        "wasmBinaryLiteral"
      ]
    },
    {
      "bxId": "110636",
      "consumers": [
        "WAWebVoipWebWasmBxRefs",
        "WAWebVoipWebWasmLoader_ContentAddressed_internal"
      ],
      "wasmHint": [
        "moduleName",
        "wasmBinaryLiteral"
      ]
    },
    {
      "bxId": "110646",
      "consumers": [
        "WAWebVoipWebWasmBxRefs",
        "WAWebVoipWebWasmLoader_ContentAddressed_internal"
      ],
      "wasmHint": [
        "moduleName",
        "wasmBinaryLiteral"
      ]
    },
    {
      "bxId": "110647",
      "consumers": [
        "WAWebVoipWebWasmBxRefs",
        "WAWebVoipWebWasmLoader_ContentAddressed_internal"
      ],
      "wasmHint": [
        "moduleName",
        "wasmBinaryLiteral"
      ]
    },
    {
      "bxId": "110648",
      "consumers": [
        "WAWebMusicMessage.react"
      ],
      "wasmHint": []
    },
    {
      "bxId": "110658",
      "consumers": [
        "WAWebVoipWebWasmBxRefs",
        "WAWebVoipWebWasmLoader_ContentAddressed_internal"
      ],
      "wasmHint": [
        "moduleName",
        "wasmBinaryLiteral"
      ]
    },
    {
      "bxId": "110659",
      "consumers": [
        "WAWebVoipWebWasmBxRefs",
        "WAWebVoipWebWasmLoader_ContentAddressed_internal"
      ],
      "wasmHint": [
        "moduleName",
        "wasmBinaryLiteral"
      ]
    },
    {
      "bxId": "110694",
      "consumers": [
        "WAWebVoipWebWasmBxRefs",
        "WAWebVoipWebWasmLoader_ContentAddressed_internal"
      ],
      "wasmHint": [
        "moduleName",
        "wasmBinaryLiteral"
      ]
    },
    {
      "bxId": "110695",
      "consumers": [
        "WAWebVoipWebWasmBxRefs",
        "WAWebVoipWebWasmLoader_ContentAddressed_internal"
      ],
      "wasmHint": [
        "moduleName",
        "wasmBinaryLiteral"
      ]
    },
    {
      "bxId": "110732",
      "consumers": [
        "WAWebVoipWebWasmBxRefs",
        "WAWebVoipWebWasmLoader_ContentAddressed_internal"
      ],
      "wasmHint": [
        "moduleName",
        "wasmBinaryLiteral"
      ]
    },
    {
      "bxId": "110733",
      "consumers": [
        "WAWebVoipWebWasmBxRefs",
        "WAWebVoipWebWasmLoader_ContentAddressed_internal"
      ],
      "wasmHint": [
        "moduleName",
        "wasmBinaryLiteral"
      ]
    },
    {
      "bxId": "110735",
      "consumers": [
        "WAWebVoipWebWasmBxRefs",
        "WAWebVoipWebWasmLoader_ContentAddressed_internal"
      ],
      "wasmHint": [
        "moduleName",
        "wasmBinaryLiteral"
      ]
    },
    {
      "bxId": "110736",
      "consumers": [
        "WAWebVoipWebWasmBxRefs",
        "WAWebVoipWebWasmLoader_ContentAddressed_internal"
      ],
      "wasmHint": [
        "moduleName",
        "wasmBinaryLiteral"
      ]
    },
    {
      "bxId": "110750",
      "consumers": [
        "WAWebVoipWebWasmBxRefs",
        "WAWebVoipWebWasmLoader_ContentAddressed_internal"
      ],
      "wasmHint": [
        "moduleName",
        "wasmBinaryLiteral"
      ]
    },
    {
      "bxId": "110751",
      "consumers": [
        "WAWebVoipWebWasmBxRefs",
        "WAWebVoipWebWasmLoader_ContentAddressed_internal"
      ],
      "wasmHint": [
        "moduleName",
        "wasmBinaryLiteral"
      ]
    },
    {
      "bxId": "110762",
      "consumers": [
        "WAWebVoipWebWasmBxRefs",
        "WAWebVoipWebWasmLoader_ContentAddressed_internal"
      ],
      "wasmHint": [
        "moduleName",
        "wasmBinaryLiteral"
      ]
    },
    {
      "bxId": "110763",
      "consumers": [
        "WAWebVoipWebWasmBxRefs",
        "WAWebVoipWebWasmLoader_ContentAddressed_internal"
      ],
      "wasmHint": [
        "moduleName",
        "wasmBinaryLiteral"
      ]
    },
    {
      "bxId": "110767",
      "consumers": [
        "WAWebVoipWebWasmBxRefs",
        "WAWebVoipWebWasmLoader_ContentAddressed_internal"
      ],
      "wasmHint": [
        "moduleName",
        "wasmBinaryLiteral"
      ]
    },
    {
      "bxId": "110768",
      "consumers": [
        "WAWebVoipWebWasmBxRefs",
        "WAWebVoipWebWasmLoader_ContentAddressed_internal"
      ],
      "wasmHint": [
        "moduleName",
        "wasmBinaryLiteral"
      ]
    },
    {
      "bxId": "110772",
      "consumers": [
        "WAWebVoipWebWasmBxRefs",
        "WAWebVoipWebWasmLoader_ContentAddressed_internal"
      ],
      "wasmHint": [
        "moduleName",
        "wasmBinaryLiteral"
      ]
    },
    {
      "bxId": "110773",
      "consumers": [
        "WAWebVoipWebWasmBxRefs",
        "WAWebVoipWebWasmLoader_ContentAddressed_internal"
      ],
      "wasmHint": [
        "moduleName",
        "wasmBinaryLiteral"
      ]
    },
    {
      "bxId": "110778",
      "consumers": [
        "WAWebVoipWebWasmBxRefs",
        "WAWebVoipWebWasmLoader_ContentAddressed_internal"
      ],
      "wasmHint": [
        "moduleName",
        "wasmBinaryLiteral"
      ]
    },
    {
      "bxId": "110779",
      "consumers": [
        "WAWebVoipWebWasmBxRefs",
        "WAWebVoipWebWasmLoader_ContentAddressed_internal"
      ],
      "wasmHint": [
        "moduleName",
        "wasmBinaryLiteral"
      ]
    },
    {
      "bxId": "110782",
      "consumers": [
        "WAWebVoipWebWasmBxRefs",
        "WAWebVoipWebWasmLoader_ContentAddressed_internal"
      ],
      "wasmHint": [
        "moduleName",
        "wasmBinaryLiteral"
      ]
    },
    {
      "bxId": "110783",
      "consumers": [
        "WAWebVoipWebWasmBxRefs",
        "WAWebVoipWebWasmLoader_ContentAddressed_internal"
      ],
      "wasmHint": [
        "moduleName",
        "wasmBinaryLiteral"
      ]
    },
    {
      "bxId": "110806",
      "consumers": [
        "WAWebVoipWebWasmBxRefs",
        "WAWebVoipWebWasmLoader_ContentAddressed_internal"
      ],
      "wasmHint": [
        "moduleName",
        "wasmBinaryLiteral"
      ]
    },
    {
      "bxId": "110807",
      "consumers": [
        "WAWebVoipWebWasmBxRefs",
        "WAWebVoipWebWasmLoader_ContentAddressed_internal"
      ],
      "wasmHint": [
        "moduleName",
        "wasmBinaryLiteral"
      ]
    },
    {
      "bxId": "110809",
      "consumers": [
        "WAWebVoipWebWasmBxRefs",
        "WAWebVoipWebWasmLoader_ContentAddressed_internal"
      ],
      "wasmHint": [
        "moduleName",
        "wasmBinaryLiteral"
      ]
    },
    {
      "bxId": "110810",
      "consumers": [
        "WAWebVoipWebWasmBxRefs",
        "WAWebVoipWebWasmLoader_ContentAddressed_internal"
      ],
      "wasmHint": [
        "moduleName",
        "wasmBinaryLiteral"
      ]
    },
    {
      "bxId": "110832",
      "consumers": [
        "WAWebHatchActivityRow.react"
      ],
      "wasmHint": []
    },
    {
      "bxId": "110833",
      "consumers": [
        "WAWebHatchActivityRow.react"
      ],
      "wasmHint": []
    },
    {
      "bxId": "110834",
      "consumers": [
        "WAWebHatchActivityRow.react"
      ],
      "wasmHint": []
    },
    {
      "bxId": "110835",
      "consumers": [
        "WAWebHatchActivityRow.react"
      ],
      "wasmHint": []
    },
    {
      "bxId": "110836",
      "consumers": [
        "WAWebHatchActivityRow.react"
      ],
      "wasmHint": []
    },
    {
      "bxId": "110837",
      "consumers": [
        "WAWebHatchActivityRow.react"
      ],
      "wasmHint": []
    },
    {
      "bxId": "110838",
      "consumers": [
        "WAWebHatchActivityRow.react"
      ],
      "wasmHint": []
    },
    {
      "bxId": "110839",
      "consumers": [
        "WAWebHatchActivityRow.react"
      ],
      "wasmHint": []
    },
    {
      "bxId": "110840",
      "consumers": [
        "WAWebHatchActivityRow.react"
      ],
      "wasmHint": []
    },
    {
      "bxId": "110841",
      "consumers": [
        "WAWebHatchActivityRow.react"
      ],
      "wasmHint": []
    },
    {
      "bxId": "110842",
      "consumers": [
        "WAWebHatchActivityRow.react"
      ],
      "wasmHint": []
    },
    {
      "bxId": "110843",
      "consumers": [
        "WAWebHatchActivityRow.react"
      ],
      "wasmHint": []
    },
    {
      "bxId": "110844",
      "consumers": [
        "WAWebHatchActivityRow.react"
      ],
      "wasmHint": []
    },
    {
      "bxId": "110845",
      "consumers": [
        "WAWebHatchActivityRow.react"
      ],
      "wasmHint": []
    },
    {
      "bxId": "110846",
      "consumers": [
        "WAWebHatchActivityRow.react"
      ],
      "wasmHint": []
    },
    {
      "bxId": "110847",
      "consumers": [